{
  "overall_score": 68,
  "grade": "C",
  "summary": "Overall score: 68/100 (Grade C). Findings: 1 critical, 2 high, 3 medium, 4 low, 1 info. Priority area: security (52/100).",
  "domain_reports": [
    {
      "domain": "security",
      "score": 52,
      "summary": "1 critical, 1 high, 1 medium",
      "findings": [
        {
          "id": "SEC-001",
          "severity": "critical",
          "title": "Exposed private key in repository",
          "description": "A PEM-formatted RSA private key was found committed in the source tree.",
          "domain": "security",
          "rule": "no-private-key",
          "confidence": 0.95,
          "evidence": [{ "file": "config/certs/dev.pem", "line": 1, "snippet": "-----BEGIN RSA PRIVATE KEY-----" }],
          "recommendation": "Remove the key from the repository, rotate it, and add the file to .gitignore.",
          "effort": "small",
          "tags": ["secret", "credentials"]
        },
        {
          "id": "SEC-002",
          "severity": "high",
          "title": "Hardcoded database connection string",
          "description": "A JDBC connection string with embedded credentials was found.",
          "domain": "security",
          "rule": "no-connection-string",
          "confidence": 0.90,
          "evidence": [{ "file": "src/main/resources/application.properties", "line": 8, "snippet": "jdbc:postgresql://admin:s3cret@db:5432/app" }],
          "recommendation": "Move credentials to environment variables or a vault.",
          "effort": "small",
          "tags": ["secret", "database"]
        },
        {
          "id": "SEC-101",
          "severity": "medium",
          "title": "Vulnerable dependency: lodash",
          "description": "Prototype pollution via lodash < 4.17.21",
          "domain": "security",
          "rule": "no-vulnerable-dependency",
          "confidence": 0.95,
          "evidence": [{ "file": "package-lock.json" }],
          "recommendation": "Run `npm audit fix` or upgrade lodash to 4.17.21+.",
          "effort": "small",
          "tags": ["dependency", "vulnerability"]
        }
      ],
      "metadata": {
        "agent": "audit-security",
        "timestamp": "2026-01-15T10:01:00.000Z",
        "duration_ms": 1200,
        "tools_used": ["inspectra_scan_secrets", "inspectra_check_deps_vulns"]
      }
    },
    {
      "domain": "tests",
      "score": 72,
      "summary": "1 high, 1 medium, 2 low",
      "findings": [
        {
          "id": "TST-001",
          "severity": "high",
          "title": "Line coverage below threshold: 58.3% < 80%",
          "description": "The line coverage is 58.3%, which is below the configured threshold of 80%.",
          "domain": "tests",
          "rule": "low-lines-coverage",
          "confidence": 1.0,
          "evidence": [{ "file": "coverage/coverage-summary.json" }],
          "recommendation": "Add tests to increase line coverage above 80%.",
          "effort": "medium",
          "tags": ["coverage"]
        },
        {
          "id": "TST-050",
          "severity": "medium",
          "title": "Failing test: UserService.createUser should validate email",
          "domain": "tests",
          "rule": "no-failing-test",
          "confidence": 1.0,
          "evidence": [{ "file": "test-results/junit.xml" }],
          "recommendation": "Fix the failing test or update it if the expected behavior changed.",
          "effort": "small",
          "tags": ["test-failure"]
        },
        {
          "id": "TST-100",
          "severity": "low",
          "title": "No test file for src/utils/date-helpers.ts",
          "domain": "tests",
          "rule": "missing-test-file",
          "confidence": 0.7,
          "evidence": [{ "file": "src/utils/date-helpers.ts" }],
          "recommendation": "Create a corresponding .test.ts or .spec.ts file.",
          "effort": "medium",
          "tags": ["missing-test"]
        },
        {
          "id": "TST-101",
          "severity": "low",
          "title": "No test file for src/services/payment.service.ts",
          "domain": "tests",
          "rule": "missing-test-file",
          "confidence": 0.7,
          "evidence": [{ "file": "src/services/payment.service.ts" }],
          "recommendation": "Create a corresponding .test.ts or .spec.ts file.",
          "effort": "medium",
          "tags": ["missing-test"]
        }
      ],
      "metadata": {
        "agent": "audit-tests",
        "timestamp": "2026-01-15T10:01:30.000Z",
        "duration_ms": 800,
        "tools_used": ["inspectra_parse_coverage", "inspectra_parse_test_results", "inspectra_detect_missing_tests"]
      }
    },
    {
      "domain": "architecture",
      "score": 80,
      "summary": "1 high, 1 low",
      "findings": [
        {
          "id": "ARC-001",
          "severity": "high",
          "title": "Layer violation: domain → infrastructure",
          "description": "File in 'domain' layer imports from 'infrastructure' layer.",
          "domain": "architecture",
          "rule": "no-layer-violation",
          "confidence": 0.8,
          "evidence": [{ "file": "src/domain/order.model.ts", "snippet": "import { OrderRepository } from '../infrastructure/order.repository'" }],
          "recommendation": "Invert the dependency using an interface in the domain layer.",
          "effort": "large",
          "tags": ["layering", "clean-architecture"]
        },
        {
          "id": "ARC-050",
          "severity": "low",
          "title": "Multiple packages with prefix 'eslint'",
          "description": "Found 4 packages starting with 'eslint'.",
          "domain": "architecture",
          "rule": "potential-duplicate-deps",
          "confidence": 0.5,
          "evidence": [{ "file": "package.json" }],
          "recommendation": "Verify whether all eslint packages are needed.",
          "effort": "small",
          "tags": ["dependencies"]
        }
      ],
      "metadata": {
        "agent": "audit-architecture",
        "timestamp": "2026-01-15T10:02:00.000Z",
        "duration_ms": 600,
        "tools_used": ["inspectra_check_layering", "inspectra_analyze_dependencies"]
      }
    },
    {
      "domain": "conventions",
      "score": 75,
      "summary": "1 medium, 1 low, 1 info",
      "findings": [
        {
          "id": "CNV-050",
          "severity": "medium",
          "title": "File too long: src/services/user.service.ts (412 lines)",
          "description": "Files longer than 300 lines are harder to maintain.",
          "domain": "conventions",
          "rule": "file-too-long",
          "confidence": 1.0,
          "evidence": [{ "file": "src/services/user.service.ts" }],
          "recommendation": "Extract classes/functions into separate files following single responsibility principle.",
          "effort": "medium",
          "tags": ["complexity", "maintainability"]
        },
        {
          "id": "CNV-100",
          "severity": "low",
          "title": "TODO comment: implement retry logic",
          "domain": "conventions",
          "rule": "unresolved-todo",
          "confidence": 1.0,
          "evidence": [{ "file": "src/utils/http-client.ts", "line": 34, "snippet": "// TODO: implement retry logic for transient failures" }],
          "recommendation": "Resolve the TODO or create a tracked issue.",
          "effort": "small",
          "tags": ["tech-debt", "todo"]
        },
        {
          "id": "CNV-101",
          "severity": "info",
          "title": "FIXME comment: deprecated API usage",
          "domain": "conventions",
          "rule": "unresolved-todo",
          "confidence": 1.0,
          "evidence": [{ "file": "src/adapters/legacy-api.ts", "line": 12, "snippet": "// FIXME: migrate to v2 API before Q3" }],
          "recommendation": "Resolve the FIXME or create a tracked issue.",
          "effort": "small",
          "tags": ["tech-debt", "fixme"]
        }
      ],
      "metadata": {
        "agent": "audit-conventions",
        "timestamp": "2026-01-15T10:02:15.000Z",
        "duration_ms": 400,
        "tools_used": ["inspectra_check_naming", "inspectra_check_file_lengths", "inspectra_check_todos"]
      }
    }
  ],
  "top_findings": [
    {
      "id": "SEC-001",
      "severity": "critical",
      "title": "Exposed private key in repository",
      "domain": "security",
      "rule": "no-private-key",
      "confidence": 0.95,
      "evidence": [{ "file": "config/certs/dev.pem", "line": 1 }],
      "recommendation": "Remove the key from the repository, rotate it, and add the file to .gitignore.",
      "effort": "small",
      "tags": ["secret", "credentials"]
    },
    {
      "id": "SEC-002",
      "severity": "high",
      "title": "Hardcoded database connection string",
      "domain": "security",
      "rule": "no-connection-string",
      "confidence": 0.90,
      "evidence": [{ "file": "src/main/resources/application.properties", "line": 8 }],
      "recommendation": "Move credentials to environment variables or a vault.",
      "effort": "small",
      "tags": ["secret", "database"]
    },
    {
      "id": "TST-001",
      "severity": "high",
      "title": "Line coverage below threshold: 58.3% < 80%",
      "domain": "tests",
      "rule": "low-lines-coverage",
      "confidence": 1.0,
      "evidence": [{ "file": "coverage/coverage-summary.json" }],
      "recommendation": "Add tests to increase line coverage above 80%.",
      "effort": "medium",
      "tags": ["coverage"]
    },
    {
      "id": "ARC-001",
      "severity": "high",
      "title": "Layer violation: domain → infrastructure",
      "domain": "architecture",
      "rule": "no-layer-violation",
      "confidence": 0.8,
      "evidence": [{ "file": "src/domain/order.model.ts" }],
      "recommendation": "Invert the dependency using an interface in the domain layer.",
      "effort": "large",
      "tags": ["layering", "clean-architecture"]
    }
  ],